{
  "authority": "community",
  "github_url": "https://github.com/taofu-labs/tpn-subnet",
  "id": "tao-private-network",
  "kind": "subnet-team",
  "logo_url": "https://metagraph.sh/logos/tao-private-network.png",
  "name": "TAO Private Network",
  "public_notes": "Subnet 65 (TAO Private Network) team profile — developer-friendly decentralised VPN infrastructure. Identity from on-chain SubnetIdentitiesV3 (name, website, source repo); X handle from taostats. Review input only (authority: community).",
  "schema_version": 1,
  "social": {
    "x": "https://x.com/tpn_labs"
  },
  "website_url": "https://tpn.taofu.xyz/"
}
