{
  "authority": "official",
  "github_url": "https://github.com/backend-developers-ltd/InfiniteHash",
  "id": "infinitehash",
  "kind": "subnet-team",
  "logo_url": "https://metagraph.sh/logos/infinitehash.png",
  "name": "InfiniteHash",
  "notes": "Provider entry for InfiniteHash SN89 source repository. The repository homepage points to infinitehash.xyz, but that deployment currently returns HTTP 402 and is not promoted as a monitored website surface.",
  "schema_version": 1,
  "website_url": "https://github.com/backend-developers-ltd/InfiniteHash"
}
