{
  "authority": "official",
  "docs_url": "https://docs.luminar.network/",
  "id": "luminar-network",
  "kind": "subnet-team",
  "logo_url": "https://metagraph.sh/logos/luminar-network.png",
  "name": "Luminar Network",
  "notes": "Provider entry for Luminar Network SN87 official website, docs, and demo surfaces.",
  "schema_version": 1,
  "website_url": "https://luminar.network/"
}
