{
  "authority": "official",
  "github_url": "https://github.com/Connito-AI/Connito",
  "id": "connito",
  "kind": "subnet-team",
  "logo_url": "https://metagraph.sh/logos/connito.png",
  "name": "Connito",
  "notes": "Provider entry for ConnitoAI SN102 website and source repository.",
  "schema_version": 1,
  "website_url": "https://connito.ai/"
}
