{
  "authority": "official",
  "docs_url": "https://bitads.ai/docs",
  "github_url": "https://github.com/FirstTensorLabs/BitAds",
  "id": "bitads",
  "kind": "subnet-team",
  "logo_url": "https://metagraph.sh/logos/bitads.png",
  "name": "BitAds",
  "notes": "Common API/OpenAPI probe paths currently return website HTML rather than machine-readable API/schema responses, so they are not promoted.",
  "public_notes": "Provider profile for BitAds / SN16. Public surfaces include the BitAds website, docs page, and source repository.",
  "schema_version": 1,
  "website_url": "https://bitads.ai/"
}
