{
  "schema_version": 1,
  "id": "degenbrain",
  "name": "DegenBrain",
  "kind": "subnet-team",
  "website_url": "https://subnet90.com/",
  "authority": "provider-claimed",
  "notes": "Provider entry for the SN90 DegenBrain website and public app surfaces. The project website identifies Subnet 90 as DegenBrain/Brain, while native chain identity currently remains ogham."
}
